{
  "schema_version": 1,
  "parent_revision": "7552af5968b4a2c10aefd01fbfa6c351817e1b8b",
  "candidate_revision": "581c23bb085718d37d994d77d59d3d70b7ea309f",
  "verdict": "pass",
  "citations": [
    {
      "rubric_id": "foundation-seed",
      "rule": "I47",
      "lines": [
        "docs/change/initial-implementation/README.md:117"
      ]
    }
  ],
  "message": "Candidate documentation is coherent with the parent foundation-seed rubric for the exact parent-to-candidate diff."
}
