{
  "schema_version": 1,
  "parent_revision": "7552af5968b4a2c10aefd01fbfa6c351817e1b8b",
  "candidate_revision": "581c23bb085718d37d994d77d59d3d70b7ea309f",
  "verdict": "pass",
  "citations": [
    {
      "rubric_id": "foundation-seed",
      "rule": "I47",
      "lines": [
        "docs/testing.md:220"
      ]
    }
  ],
  "message": "Fixture documents a determinate pass response shape only; it is not publication authority."
}
